{
  "run_id": "87d469f7-a467-4df5-a751-8bfc486ab2c6",
  "task_id": "44389",
  "task_set": "main_v04",
  "condition": "P0",
  "protocol_version": "0.4.1",
  "replicate": 1,
  "started_at": "2026-09-03T20:00:45.771027+00:00",
  "completed_at": "2026-09-03T20:04:21.388661+00:00",
  "reproducibility": {
    "schema_git_commit": "<commit>",
    "benchmark_git_commit": "<commit>",
    "dataset_archive_sha256": "10ef893dd29cb13ab97143ea787e68cdc9574a13873ab9a54e50b31dc03fc949",
    "docker_image_digest": "sha256:8c861ae2b9511d19225f4f2433f4366311a32a55ad13dc29735a76c6fd165ffb",
    "worker_model": "claude-sonnet-4-5-20250929",
    "parent_model": "claude-sonnet-4-5-20250929",
    "temperature": 0.0,
    "git_dirty": false,
    "workspace_header_used": true,
    "worker_prompt_hash": "76fb104317fe5c72473ac423e9689f92162447c92983cf70bca552f87328d55b",
    "parent_prompt_hash": "0193f4a73fd2c1c837363dd75e890b03e1fba21f221e043f33b5d968c76ef209",
    "libreoffice_version": "26.8.0.3",
    "task_selection_package": "config/task_selection_v03",
    "selection_sha256": "cf818c1c9be7568223245e89a705d94d64aa7d99e4341604414378571f11752d"
  },
  "budgets": {
    "worker": {
      "max_turns": 40,
      "max_tool_calls": 100,
      "max_wall_seconds": 1200,
      "max_tokens": 8192,
      "max_input_tokens_safety": 1500000,
      "max_output_tokens_total": 64000
    },
    "parent": {
      "max_turns": 40,
      "max_tool_calls": 100,
      "max_wall_seconds": 1200,
      "max_tokens": 8192,
      "max_input_tokens_safety": 1500000,
      "max_output_tokens_total": 64000
    }
  },
  "usage": {
    "worker": {
      "input_tokens": 24,
      "output_tokens": 2691,
      "cache_read_input_tokens": 13197,
      "cache_creation_input_tokens": 4042,
      "model_calls": 5,
      "tool_calls": 6,
      "validation_cycles": 0,
      "wall_seconds": 49.624,
      "budget_exhausted": false,
      "budget_exhausted_on": null,
      "safety_exhausted": false,
      "safety_exhausted_on": null,
      "observed_output_calls": 0,
      "auto_observations": 0
    },
    "parent": {
      "input_tokens": 85,
      "output_tokens": 4810,
      "cache_read_input_tokens": 232915,
      "cache_creation_input_tokens": 20271,
      "model_calls": 17,
      "tool_calls": 18,
      "validation_cycles": 3,
      "wall_seconds": 158.325,
      "budget_exhausted": false,
      "budget_exhausted_on": null,
      "safety_exhausted": false,
      "safety_exhausted_on": null,
      "observed_output_calls": 0,
      "auto_observations": 3
    }
  },
  "handoff": {
    "memo_path": "<REPO>",
    "memo_sha256": "07203f4d498f6c1b9e3bd57dc4b599fb602162f796794b11e014b5bf8edf6a60",
    "candidate_script_path": "<REPO>",
    "candidate_script_sha256": "bc6825631b0d3ca6865583501af21fe9ca044d3405ebbc6692b60eded69f9b8b",
    "worker_submitted_memo": true,
    "worker_submitted_candidate": true,
    "memo_claims_validation": true
  },
  "worker_outcome": {
    "evaluator_status": "ok",
    "full_task_success": 0,
    "target_unit_pass_rate": 0.0,
    "n_units": 6,
    "output_path": "<REPO>",
    "evaluator_path": "<REPO>",
    "output_sha256": "1f58773f523add3d4dac4cc18a459f88bfcbc3bf3a50e8bd5a2765c676762a3a"
  },
  "final_outcome": {
    "evaluator_status": "ok",
    "full_task_success": 1,
    "target_unit_pass_rate": 1.0,
    "n_units": 6,
    "output_path": "<REPO>",
    "evaluator_path": "<REPO>",
    "output_sha256": "986187e2bd7b4b06e89042cab8e90cc6ef2bd122133bd1e4a86dd81d4a97cc07"
  },
  "unsealed_last_script_score": null,
  "final_script_path": "<REPO>",
  "final_script_sha256": "763ef260574c473c30f881e63241f637592ea324095c4d5395f59934fafcec0f",
  "accepted_unchanged": false,
  "failures": [],
  "compliance": {
    "artifact_crossed_handoff": true,
    "worker_feedback_calls": 0,
    "parent_finalized": true,
    "worker_scratch_destroyed": true,
    "worker_submitted": true,
    "worker_observed_output_calls": 0,
    "worker_revised_after_observation": false,
    "worker_auto_observations": 0,
    "parent_auto_observations": 3,
    "eligible_worker_run_events": 0,
    "eligible_parent_run_events": 3,
    "worker_runs_without_auto_observation": 0,
    "parent_runs_without_auto_observation": 0
  },
  "status": "complete",
  "analysis_included": true,
  "analysis_inclusion_reason": "Structurally valid main_v04 episode; inclusion confirmed post-run."
}
